200,B0BRP2CVQR,"Dell 2022 XPS 15 9520 Laptop 15.6"" FHD+ 500 nit Display 14-Core 12th Intel Core i7-12700H NVIDIA RTX 3050 Ti 4GB GDDR6 32GB DDR5 2TB NVMe SSD Thunderbolt 4 WiFi 6E Backlit KB FP Reader Windows 11 Pro","$2,619.00","January 5, 2023",15.6 Inches,1920 x 1200 pixels,1920 x 1200 Pixels,2.9 GHz core_i7_family,32 GB DDR5,,2 TB SSD,NVIDIA GeForce RTX 3050 Ti,NVIDIA,Dedicated,802.11ax,3,9 Hours,Dell,XPS 15 9520,XPS 9520,PC,Windows 11 Pro,10 pounds,13.56 x 9.06 x 0.73 inches,,Platinum Silver,Intel,14,DDR5 SDRAM,,PCIE x 4,No Optical Drive,AC & Battery,
200,B09NLX2SMP,"HP 2022 Newest 17.3"" HD+ Display Laptop, 11th Gen Intel Core i3-1115G4(Up to 4.1GHz, Beat i5-1030G7), 16GB DDR4 RAM, 1TB HDD+256GB PCIe SSD, Bluetooth, Webcam, Windows 11, Silver, w/ 3in1 Accessories",$469.00,"November 22, 2021",17.3 Inches,,1600 x 900 Pixels,4.1 GHz core_i3_1115g4,16 GB DDR4,4.1 GHz,256 GB SSD,Intel UHD Graphics,Intel,Integrated,802.11a/b/g/n/ac,2,8 Hours,HP,,HP,PC,Windows 11,5.2 pounds,16.33 x 10.72 x 0.96 inches,,Natural Silver,Intel,2,DDR4 SDRAM,256 GB,Solid State,DVD+W,AC & Battery,
200,B0BJCKZFZ3,"HP 14 FHD Laptop for Student & Business, 6-Core AMD Ryzen 5 5500U (Beats Intel i7-1065G7), Thin & Portable, Micro-Edge & Anti-Glare Screen, Long Battery Life, Windows 11 Home (16GB|512GB SSD)",$531.99,"October 17, 2022",14 Inches,,1920 x 1080 Pixels,4 GHz ryzen_5,16 GB DDR4,3200 MHz,512 GB SSD,AMD Radeon Graphics,AMD,Integrated,802.11ax,3,9.15 Hours,HP,HP 14inch,,PC,Windows 11 Home,3.7 pounds,12.76 x 0.71 x 8.86 inches,,Natural Silver,AMD,6,DDR4 SDRAM,,Solid State,no,,1 Lithium Ion batteries required. (included)
200,B084SKWC89,"HP Stream 14-inch Laptop, Intel Celeron N4000, 4 GB RAM, 64 GB eMMC, Windows 10 Home in S Mode With Office 365 Personal For 1 Year (14-cb185nr, Royal Blue)",$225.00,"March 1, 2020",14 Inches,,1366 x 768 Pixels,2.6 GHz celeron_n4000,4 GB 4GB SDRAM,2.6 GHz,64 GB Embedded MultiMediaCard,,Intel,Integrated,"802.11a/b/g/n/ac, Bluetooth",2,10 Hours,HP,Stream Laptop,9MV84UA#ABA,,Windows 10 Home,3.17 pounds,8.9 x 13.27 x 0.7 inches,,Royal Blue,Intel,2,DDR4 SDRAM,,,No Optical Drive,Battery Powered,1 Lithium Metal batteries required. (included)
200,B0BJKCLHLN,"HP 2022 Victus 15 Gaming Laptop, 15.6"" FHD IPS Display, Intel Core i5-12500H(Beat i7-11800H), NVIDIA Geforce RTX 3050, 32GB RAM, 1TB PCIe SSD, WiFi 6E, HDMI, Backlit KB, Win 11 H, w/GM Accessories",$899.00,"October 18, 2022",15.6 Inches,,1920 x 1080 Pixels,4 GHz apple_ci5,32 GB DDR4,,512 GB SSD,NVIDIA GeForce RTX 3050,NVIDIA,Dedicated,Bluetooth,,,HP,,HP,PC,Windows 11 Home,5.06 pounds,14.09 x 10.04 x 0.93 inches,,,Intel,12,DDR4 SDRAM,1 TB,PCIE x 4,,AC & Battery,1 Lithium Ion batteries required. (included)
200,B0BB8ZDHG1,"HP 2022 14"" FHD IPS Display Laptop, AMD Ryzen 3-3250U, 8GB RAM, 128GB PCIe SSD, AMD Radeon Graphics, True Vision HD Camera, Wi-Fi 5 and Bluetooth, Windows 11 S, Silver, 32GB Snow Bell USB Card",$339.00,"July 17, 2022",14 Inches,,1920 x 1080 Pixels,2.6 GHz ryzen_3,8 GB DDR4,,128 GB SSD,AMD Radeon Graphics,AMD,Integrated,802.11ac,2,,HP,HP 14,HP Laptop,PC,Windows 11 S,3 pounds,12.6 x 7.8 x 0.72 inches,,Silver,AMD,2,DDR4 SDRAM,128 GB,Solid State,,AC & Battery,
200,B0BFX23BF9,"HP Envy X360 15 2-in-1 Touchscreen (Ryzen 5 5625U, 32GB RAM, 1TB SSD, Active Stylus, Laptop Bag) AMD 6-Core(Beat i7-1165G7) 15.6"" FHD Convertible Laptop, Backlit, Pen, Alexa, Windows 11 Home - 2022",$829.99,"September 20, 2022",15.6 Inches,1920 x 1080 pixels,,2.3 GHz amd_r_series,32 GB DDR4,3200 MHz,1 TB SSD,AMD Radeon Graphics,AMD,Integrated,Bluetooth,3,,HP,HP ENVY X360,HP ENVY X360,PC,Windows 11 Home,6.78 pounds,14.13 x 0.73 x 9.02 inches,,Nightfall black,AMD,6,DDR4 SDRAM,,Solid State,No Optical Drive,,1 Lithium Ion batteries required. (included)
200,B09RQZNMQW,"HP Laptop 15-dy0025tg 15.6"" HD (1366 x 768) Intel Pentium Silver N5030, Intel UHD Graphics 605, 8GB DDR4 RAM, 256GB SSD Storage, Windows 10 Home, Natural Silver (Renewed)",,"February 3, 2022",15.6 Inches,,1360 x 768 Pixels,1.1 GHz pentium_N5000,8 GB DDR4,2400 MHz,256 GB SSD,Intel UHD Graphics 605,Intel,Integrated,,,11 Hours,HP,15,,PC,Windows 10 Home,4.29 pounds,18.8 x 12.4 x 3.3 inches,,Silver,Intel,4,DDR DRAM,256 GB,Solid State,No Optical Drive,,1 Lithium Polymer batteries required. (included)
200,B0BM51N77S,"Lenovo Ideapad 15.6"" HD Laptop, Athlon Silver 3050U (Beats i3-1005G1) Dual-core Processor, 8GB RAM, 128GB SSD, WiFi, Webcam, Bluetooth, Win 11 S, Cloud Grey, TGC Bundle",$279.95,"November 11, 2022",15.6,,1366 x 768,2.3 GHz athlon_3050u,8 GB DDR4,,128 GB SSD,AMD Radeon Graphics,AMD,Integrated,Bluetooth,2,,Lenovo,Lenovo IdeaPad,,,Windows 11,3.52 pounds,12.81 x 0.7 x 9.51 inches,,,AMD,2,,128 GB,,,,1 Lithium Ion batteries required. (included)
200,B09QFH8XQY,"Lenovo IdeaPad 3i Laptop 10th Gen i5 10210U, 14"" FHD 1080p, 8GB DDR4, 512GB SSD Win 11 Home Platinum Grey",$279.00,"January 14, 2022",14 Inches,,1920 x 1080 Pixels,1.6 GHz core_i5_10210u,8 GB DDR4,2666 MHz,512 GB SSD,Integrated Intel UHD Graphics,Intel,Integrated,Bluetooth,1,,Lenovo,Lenovo Ideapad,81WA00Q7US,PC,Windows 10 Home,4.66 pounds,13 x 1 x 15 inches,,Black,AMD,4,DDR4 SDRAM,512 GB,ATA,No Optical Drive,,
200,B0B3L48YH9,"2022 Newest HP Pavilion 15.6"" HD Laptop, Intel Quad-core Pentium Processor, 16GB RAM, 1TB SSD, 11 Hr Battry Life, Intel UHD Graphics, HD Webcam, Bluetooth, HDMI, USB Type-C, Scarlet Red, Win 11",$469.00,"June 8, 2022",,,,,,,,,,,,,,,,Pavilion,,,5.39 pounds,,,,,,,,,,,
200,B09FXLRBFQ,"HP 17-inch Laptop, 11th Generation Intel Core i5-1135G7, Iris Xe Graphics, 8 GB RAM, 256 GB SSD, Windows 11 Home (17-cn0025nr,Natural Silver)",$540.00,"October 5, 2021",17.3 Inches,1600 x 900),1600 x 900 Pixels,4.2 GHz intel_core_i5_1135g7,256 GB 8 GB DDR4,,256 GB SSD,Intel Iris Xe Graphics,Intel,Integrated,"Bluetooth, 802.11ax",3,8.15 Hours,HP,HP Laptop 17-cn0025nr,17-cn0025nr,,Windows 11 Home,4.53 pounds,15.78 x 10.15 x 0.78 inches,,Natural silver,Intel,4,DDR4 SDRAM,,,No Optical Storage Device,AC & Battery,1 Lithium Ion batteries required. (included)
200,B08H6YZY3Y,"HP Chromebook 11-inch Laptop - Up to 15 Hour Battery Life - MediaTek - MT8183 - 4 GB RAM - 32 GB eMMC Storage - 11.6-inch HD Display - with Chrome OS™ - (11a-na0021nr, 2020 model, Snow White)",$159.99,"October 4, 2020",11.6 Inches,,1366 x 768 Pixels,2 GHz mediatek_mt8183,4 GB 4 GB LPDDR4,,32 GB Embedded MultiMediaCard,,Integrated,Integrated,"802.11a/b/g/n/ac, Bluetooth",,15.45 Hours,HP,Chromebook 11a,11a-na0021nr,Google,Chrome OS,2.36 pounds,11.22 x 7.59 x 0.66 inches,,Snow White,MediaTek,8,SDRAM,,USB,No Optical Drive,Battery Powered,1 Lithium Metal batteries required. (included)
200,B0B2LC534D,"HP Pavilion 15.6"" Touchscreen Laptop - AMD Ryzen 7 5825U - 1080p - Windows 11 Notebook 15-eh2085cl 16GB RAM 512GB SSD",$667.49,"May 28, 2022",15.6 Inches,,1920 x 1080 Pixels,2 GHz ryzen_7,16 GB DDR4,,SSD,AMD Radeon Graphics,AMD,Integrated AMD Radeon Graphics,Bluetooth,1,6 Hours,HP,15-eh2085cl,15-eh2085cl,,Windows 11,5.32 pounds,,,,AMD,1,,16 GB,Solid State,,Battery Powered,1 Lithium Ion batteries required. (included)
200,B09F5D1NWC,"HP 2022 15.6"" FHD Notebook Laptop Computer, Intel Celeron N4020 Processor, 16GB DDR4 RAM, 256GB SSD, 1-Year Office 365, Webcam, WiFi, RJ-45, Windows 10 Home in S Mode, Ipuzzl Type-C HUB",$429.00,"September 1, 2021",15.6 Inches,1920 x 1080 pixels,1920x1080,1 celeron,16 GB DDR4,2.8 GHz,256 GB SSD,Intel UHD Graphics 600,Intel,Integrated,"Bluetooth, 802.11a",,,HP,HP 15,15-dw,PC,Windows 10 S,3.92 pounds,14.11 x 9.52 x 0.78 inches,,Black,Intel,2,DDR4 SDRAM,,Solid State,No Optical Drive,"Corded Electric, Battery Powered",
200,B0B1QSJTJJ,"HP Pavilion Laptop (2022 Model), 14"" FHD IPS NonTouch Display, AMD Ryzen 3 3250U, 8GB RAM, 128GB SSD, Micro-Edge, Thin & Portable, Micro-Edge & Anti-Glare Screen, Long Battery Life, Win 11",$324.99,"May 19, 2022",,,,,,,,,,,,,,,,Pavilion,,,3.24 pounds,14 x 11 x 2 inches,,,,,,,,,,
200,B0B67521S5,"HP - Victus 15.6"" Gaming Laptop - Intel Core i5-12450H - 8GB Memory - NVIDIA GeForce GTX 1650-512GB SSD - Mica Silver - Model 15-fa0031dx",$629.00,"July 10, 2022",15 Inches,,1920x1080,3.4 core_i5,8 GB DDR4,3200 MHz,512 GB SSD,NVIDIA GeForce GTX 1650,NVIDIA,Dedicated,Bluetooth,3,,HP,Laptop,15-fa0031dx,,Windows 10 Home,5.3 pounds,14 x 1 x 4 inches,,Mica Silver,Intel,8,DDR4 SDRAM,,ESATA,,,1 Lithium Ion batteries required.
200,B09J6NP7SB,Dell Latitude 5480 14-inch Business Laptop Notebook PC Intel i5-6300U 2.4GHz 8GB DDR4 500GB HDD Backlit Keyboard Windows 10 Pro (Renewed),$185.00,"October 11, 2021",14 Inches,1366x768,1366 x 768 Pixels,2.4 GHz core_i5_family,8 GB SDRAM,2400 MHz,500 GB HDD,Intel Graphics,Intel,,802.11a,,,Dell,Dell Latitude,Dell 5480,PC,Windows 10 Pro,5.94 pounds,13.1 x 9 x 0.88 inches,,,Intel,2,DDR4 SDRAM,,Serial ATA,,AC & Battery,
200,B081FJG5L5,"Lenovo ThinkPad T460 14-inch HD, Core i5-6300U 2.4GHz, 16GB RAM, 1TB Solid State Drive, Windows 10 Pro 64Bit, (Renewed)",$261.00,"November 13, 2019",14 Inches,,,2.4 GHz,16 GB DDR4,,SSD,,Intel,,,,,Lenovo,Lenovo Thinkpad,,,,5.54 pounds,,,,,,DDR3 SDRAM,,Solid State,,,1 Lithium Ion batteries required. (included)
200,B09X875G5B,"Newest HP 14"" Flagship Laptop, Windows 11 OS, AMD Dual-Core Processor Up to 2.60 GHz, 4GB RAM, 64GB SSD, Webcam, Silver (Renewed)",$159.00,"April 5, 2022",14 Inches,,,2.6 GHz,4 GB,2.6 GHz,SSD,,AMD,,Bluetooth,,,HP,,"HP 14"" Laptop",,Windows 11,4.4 pounds,12.89 x 8.9 x 0.9 inches,,,AMD,2,DDR4 SDRAM,,USB,,,1 Lithium Ion batteries required.
200,B0BRQVG7D3,ASUS 2023 ROG Strix Scar G533 15.6” 300Hz FHD Gaming Laptop PC 12th Intel 14-Core i9-12900H 64GB DDR5 2TB SSD NVIDIA GeForce RTX 3060 6GB WiFi 6E Thunderbolt4 RGB Backlit Windows 11 Pro w/ RE USB,"$2,389.99","January 5, 2023",15.6 Inches,1920 x 1080 pixels,1920x1080 Pixels,3 GHz core_i9,64 GB DDR5,4800 MHz,2 TB SSD,NVIDIA GeForce RTX 3060,NVIDIA,Dedicated,Bluetooth,4,6 Hours,ASUS,ROG STRIX SCAR,G533ZM,PC,Windows 11 Pro,10 pounds,13.94 x 10.2 x 0.89 inches,,Off Black,Intel,14,DDR5 SDRAM,,Solid State,No Optical Drive,AC & Battery,
200,B0BGCGZZFZ,"ASUS 2022 11.6"" HD Business Laptop, Intel Celeron N4500 Processor, 4GB RAM, 64GB eMMC , Webcam, Intel HD Graphics 500, Bluetooth, Windows 10 Pro, Dark Grey, 32GB SnowBell USB Card",$179.00,"September 24, 2022",11.6 Inches,,1366 x 768 Pixels,2.8 GHz celeron_n,4 GB DDR4,,64 GB SSD,Intel HD Graphics 500,Intel,Integrated,Bluetooth,,,ASUS,,ASUS,PC,Windows 10 Pro,2.3 pounds,8.1 x 0.8 x 11.6 inches,,Dark Grey,Intel,2,DDR4 SDRAM,64 GB,Solid State,,,
200,B09BKDKNT3,"ASUS L410 MA-DB04 Ultra Thin Laptop, 14” FHD Display, Intel Celeron N4020 Processor, 4GB RAM, 128GB Storage, NumberPad, Windows 10 Home in S Mode, Star Black",$172.38,"July 31, 2021",14 Inches,1920 x 1080 pixels,1920 x 1080 Pixels,2.8 GHz celeron_n4020,4 GB DDR4,2400 MHz,128 GB Emmc,Intel UHD Graphics 600,Intel,Integrated,"Bluetooth, 802.11ac",2,,ASUS,ASUS Laptop L410,L410MA-DB04,PC,Windows 10 S,2.87 pounds,12.8 x 8.54 x 0.72 inches,,Star Black,Intel,2,DDR4 SDRAM,128 GB,USB 3.2,No Optical Drive,Battery Powered,1 Lithium Ion batteries required. (included)
200,B09LRQN119,"ASUS BR1100 Laptop, 11.6"" HD Anti-Glare Touchscreen Display, Intel Celeron N4500, 4GB RAM, 64GB Storage, MIL-STD 810H Durability, TPM 2.0, Windows 10 Pro, Dark Grey, Stylus Included, BR1100FKA-502YT",$151.00,"November 13, 2021",11.6 Inches,1366 x 768 pixels,1366 x 768 Pixels,2.8 GHz celeron,4 GB DDR4,2.8 GHz,64 GB SSD,Intel UHD Graphics,Intel,Integrated,"Bluetooth, 802.11ac",3,10 Hours,ASUS,ASUS BR1100,BR1100FKA-502YT,Windows,Windows 10 Pro,2.67 pounds,11.6 x 0.78 x 8.07 inches,,Dark Grey,Intel,2,DDR4 SDRAM,4 GB,Solid State,No Drive,,1 Lithium Ion batteries required. (included)
200,B08529H6B9,"HP Chromebook 14-inch HD Touchscreen Laptop, Intel Celeron N4000, 4 GB RAM, 32 GB eMMC, Chrome (14a-na0040nr, Ceramic White)",$239.00,"April 19, 2020",14 Inches,,1366 x 768 Pixels,1.1 GHz celeron_n,4 GB LPDDR4,2.6 GHz,Embedded MultiMediaCard,,Intel,Integrated,,,13.5 Hours,HP,Chromebook,14a-na0040nr,,Chrome OS,3.2 pounds,12.82 x 8.6 x 0.7 inches,,Ceramic White,Intel,2,DDR4 SDRAM,4,USB,No Optical Drive,Battery Powered,1 Lithium Polymer batteries required. (included)
200,B0BFJJ9421,"HP 15 Touchscreen Laptop, Intel Core i3-1115G4 Processor, Intel UHD Graphics, 15.6"" HD Touchscreen Display, Online Meeting Ready, Fast Charge, HDMI, Windows 11 Home(16GB RAM | 1TB SSD)",$549.00,"September 16, 2022",,,,,,,,,,,,,,,,HP 15 Laptop,,,3.74 pounds,14.11 x 9.53 x 0.71 inches,,,,,,,,,,
200,B01MRS3MIS,"HP 15-F222WM 15.6"" Touch Screen Laptop (Intel Quad Core Pentium N3540 Processor, 4GB Memory, 500GB Hard Drive, Windows 10)",$562.03,"January 20, 2016",15.6 Inches,1366x768,1366 x 768 Pixels,2.16 GHz pentium_n3540,4 GB DDR3,1600 MHz,500 GB Mechanical Hard Drive^SATA,Intel HD Graphics,Intel,Integrated,"802.11n, 802.11b, 802.11g",2,6 Hours,HP,Hp 15 pentium,N5Y13UA#ABA,PC,Windows 10,5.05 pounds,20 x 12 x 3 inches,,Black,Intel,2,DDR3 SDRAM,,Serial ATA,,AC & Battery,1 Lithium Polymer batteries required.
200,B0BM51N77S,"Lenovo Ideapad 15.6"" HD Laptop, Athlon Silver 3050U (Beats i3-1005G1) Dual-core Processor, 8GB RAM, 128GB SSD, WiFi, Webcam, Bluetooth, Win 11 S, Cloud Grey, TGC Bundle",$279.95,"November 11, 2022",15.6,,1366 x 768,2.3 GHz athlon_3050u,8 GB DDR4,,128 GB SSD,AMD Radeon Graphics,AMD,Integrated,Bluetooth,2,,Lenovo,Lenovo IdeaPad,,,Windows 11,3.52 pounds,12.81 x 0.7 x 9.51 inches,,,AMD,2,,128 GB,,,,1 Lithium Ion batteries required. (included)
200,B0BKV2NPQG,"HP 14 Laptop, AMD Ryzen 5 5500U, 8 GB RAM, 256 GB SSD Storage, 14-inch Full HD & WD 1TB Elements SE - Portable SSD, USB 3.0, Compatible with PC, Mac - WDBAYN0010BBK-WESN",$474.40,"October 29, 2022",,,,,DDR4,,,AMD Radeon R5,AMD,Integrated,,,,HP,,,,Windows 10 Home,,,,,AMD,,,,,,,
200,B07GCRW5BM,"Dell Latitude E5570 15.6in Laptop, Core i5-6300U 2.4GHz, 8GB Ram, 256GB SSD, Windows 10 Pro 64bit (Renewed)",$239.00,"August 11, 2018",15.6 Inches,1366x768,,2.4 GHz core_i5_6260u,8 GB DDR4,2.4 GHz,256 GB SSD,Intel HD Graphics 520,Intel,Integrated,"2.4 GHz Radio Frequency, 801.11ac",,,Dell,Dell Latitude,Latitude E5570,PC,Windows 10,4.6 pounds,14.8 x 9.9 x 0.9 inches,,Black,Intel,2,DDR4 SDRAM,256,USB,No Optical Drive,,1 Lithium Polymer batteries required. (included)
200,B0B6FM8X26,"ASUS Vivobook S 14 Flip OLED 90Hz 14” 2.8K OLED 16:10 Touch Display, AMD Ryzen 7 5800H CPU, 16GB RAM, 1TB SSD, NumberPad, Fingerprint, Stylus Supported, Windows 11 Home, Quiet Blue, TN3402QA-DS76T","$1,089.26","‎July 13, 2022",14 Inches,,2880x1800 Pixels,4.4 GHz ryzen_7_5800h,,,1 TB SSD,AMD Radeon Graphics,AMD,Integrated,"Bluetooth, 802.11ax",2,,ASUS,Vivobook S 14 Flip OLED,TN3402QA-DS76T,PC,Windows 11 Home,3.31 pounds,12.33 x 0.74 x 8.96 inches,,Blue,AMD,8,DDR4 SDRAM,1 TB,Solid State,No Optical Drive,,1 Lithium Ion batteries required. (included)
200,B0B1C146NQ,"Dell 2022 G15 15.6"" 120Hz FHD Gaming Laptop 8-Core AMD Ryzen 7 6800H 32GB DDR5 1TB NVMe SSD NVIDIA GeForce RTX 3050TI 4GB GDDR6 Webcam HDMI2.1 WiFi AX BT RJ-45 USB-C Backlit Keyboard Windows 11 Home",,"November 9, 2022",15.6 Inches,1920 x 1080 pixels,1920x1080 Pixels,3.2 GHz core_i7_11800h,32 GB DDR5,4800 MHz,1 TB SSD,NVIDIA GeForce RTX 3050 Ti,NVIDIA,Dedicated,802.11ax,2,6 Hours,Dell,G15,G15,PC,Windows 11 Home,5.39 pounds,14.1 x 10.4 x 0.98 inches,,Gray,AMD,8,DDR5 SDRAM,,Solid State,No Optical Drive,AC & Battery,1 Lithium Ion batteries required. (included)
200,B09C47W1W4,"Dell Inspiron 15 3000, 3511 15.6-inch FHD (1920 x 1080) Laptop 11th Gener ation Intel(R) Core(TM) i3-1115G4 Processor 8GB, 8Gx1, DDR4, 2666MHz 128GB M.2 PCIe NVMe Solid State Drive",$389.90,"August 8, 2021",15.6 Inches,,,4.1 GHz apple_ci3,8 GB DDR4,4.1 GHz,SSD,,Intel,Integrated,"Bluetooth, 802.11ac",,,Dell,Dell Inspiron,Dell 3511,,Windows 10 Home,5.55 pounds,13.94 x 9.88 x 0.81 inches,,Black,Intel,1,DDR DRAM,500 GB,Solid State,No Optical Drive,,
200,B0B847QFX4,"HP Pavilion Laptop 15-eg2053cl, 15.6"" FHD Touch Screen, Windows 11 Home, Intel Core i5-1235U, 12GB DDR4 RAM, 512GB SSD Storage, Natural Silver (Renewed)",$521.99,"July 29, 2022",15.6 Inches,,1920x1080 Pixels,4.4 GHz core_i5,12 GB DDR4,,512 GB SSD,Intel HD Graphics 520,Intel,Integrated,,,,HP,HP Pavilion,15-EG2053CL,,Windows 11 Home,5.04 pounds,14.18 x 9.21 x 0.7 inches,,Natural Silver,Intel,10,,,,No Optical Drive,,1 Lithium Polymer batteries required. (included)
200,B09W8PP5NY,"HP 17.3-inch Laptop, 11th Generation Intel Core i5-1135G7, Intel Iris Xe Graphics, 8 GB RAM, 512 GB SSD, Windows 11 Home (17.3-cn0026nr,Natural Silver)",$599.00,"April 3, 2022",17.3 Inches,1600 x 900 pixels,1600 x 900 Pixels,4.2 GHz intel_core_i5_1135g7,512 GB 8 GB DDR4,4.2 MHz,512 GB SSD,Intel Iris Xe Graphics,Intel Iris Xe,Integrated,"Bluetooth, 802.11a/b/g/n",3,8.45 Hours,HP,HP Laptop 17-cn0026nr,17-cn0026nr,,Windows 11 Home,4.6 pounds,10.15 x 0.78 x 15.78 inches,,Natural Silver,Intel,4,DDR4 SDRAM,,Solid State,No optical storage device,Battery Powered,1 Lithium Ion batteries required. (included)
200,B0B3M3P6DB,"2022 HP 14"" HD Laptop, Windows 11, Intel Celeron Dual-Core Processor Up to 2.80GHz, 4GB RAM, 64GB SSD, Chromes OS, Cobalt Blue (Renewed)",$215.00,"June 8, 2022",14,,1366 x 768 Pixels,,DDR4,,,Intel UHD Graphics,Intel,,,,,HP,,HP 14inch Laptop,,Windows 11,4.51 pounds,14 x 10 x 1 inches,,,Intel,,,4 GB,,,,1 Lithium Ion batteries required.
200,B09MNW21S6,"2022 Lenovo IdeaPad Slim 9i 14"" 4K UHD (3840x2160) Touchscreen Laptop: 11th Gen Intel Core i7-1195G7, 16GB DDR4 RAM, 512GB PCIE SSD, Backlit Keyboard, Windows 11",$837.49,"September 23, 2022",14 Inches,3840 x 2160 pixels,3840x2160 Pixels,2.9 GHz apple_ci7,16 GB LPDDR4,4266 MHz,512 GB SSD,Intel Iris Xe Graphics,Intel,Integrated,802.11ax,3,,Lenovo,IdeaPad Slim 9i,82D2,PC,Windows 11,12 pounds,13 x 1 x 8 inches,,Black,Intel,4,DDR4 SDRAM,512 GB,Solid State,,,
200,B07CSQDR4N,"HP 2018 Elitebook 840 G1 14inch HD LED-backlit anti-glare Laptop Computer, Intel Dual-Core i5-4300U up to 2.9GHz, 8GB RAM, 500GB HDD, USB 3.0, Bluetooth, Window 10 Professional (Renewed)",,"April 7, 2018",14 Inches,,,2.9 GHz core_i5_4300u,8 GB DDR,2133 MHz,500 GB HDD,Intel,Intel,Integrated,"802.11a/b/g/n, 802.11ac",3,,HP,HP EliteBook,Elitebook 840 G1,PC,Windows 10 Pro,6 pounds,21 x 9 x 3 inches,,Grey/silver,Intel,2,DDR2 SDRAM,,Serial ATA,No Optical Drive,Battery Powered,1 Lithium Polymer batteries required. (included)
200,B07H6LXXDV,Dell Latitude 5590 Business Laptop | 15.6in HD Screen | Intel Quad Core 8th Gen i7-8650U | 16GB DDR4 RAM | 512GB SSD | Windows 10 Professional (Renewed),$429.00,"September 5, 2018",15.6 Inches,,1920x1080,1.9 GHz core_i7_8650u,16 GB DDR4,,512 GB SSD,Intel UHD Graphics 620,Intel,Integrated,Bluetooth,,,Dell,Dell Latitude,Latitude 5590,,Windows 10 Pro,3.12 pounds,14.8 x 9.9 x 0.9 inches,,,Intel,4,SDRAM,512 GB,Solid State,,Corded Electric,1 Lithium Ion batteries required. (included)
200,B09TD1QN39,"ASUS TUF Dash 15 (2022) Gaming Laptop, 15.6” 144Hz FHD Display, Intel Core i7-12650H, GeForce RTX 3050 Ti, 16GB DDR5, 512GB SSD, Thunderbolt 4, Windows 11 Home, Off Black, FX517ZE-ES73","$1,099.00","February 25, 2022",15.6 Inches,,1920 x 1080 Pixels,4.7 core_i7,16 GB DDR5,,512 GB,,NVIDIA,RTX 3050 Ti,Bluetooth,3,,ASUS,ASUS TUF Dash 15,FX517ZE-ES73,,Windows 11 Home,7.84 pounds,13.94 x 9.88 x 0.78 inches,,Off Black,Intel,10,,512 GB,Thunderbolt,No Drive,,1 Lithium Ion batteries required. (included)
200,B0BH549BWB,"HP 17 inch Laptop with Backlit Keyboard, Intel Core i7-1165G7 Processor, Intel Iris Xe Graphics, 17.3 inch FHD Display, Backlit Keyboard, Fingerprint Reader, HDMI, Windows 11 Home(32GB RAM | 1TB SSD)",$869.00,"October 3, 2022",,,,,,,,,,,,,,,,Laptop,,,3.78 pounds,15.75 x 10.15 x 0.78 inches,,,,,,,,,,1 Lithium Ion batteries required.
200,B07GLV1VC7,"Lenovo Chromebook S330 Laptop, 14-Inch FHD Display, MediaTek MT8173C, 4GB RAM, 64GB Storage, Chrome OS",$149.99,"August 9, 2018",14 Inches,,1920X1080 Pixels,2.1 GHz mediatek_mt8173c,4 GB LPDDR3,1866 MHz,64 GB SSD,,Intel,Integrated,802.11ac,1,10 Hours,Lenovo,Chromebook S330,81JW0000US,Chrome,Chrome OS,3.3 pounds,12.82 x 0.82 x 9.15 inches,,Business Black,MediaTek,4,Unknown,64,Solid State,,Battery Powered,1 Lithium Polymer batteries required. (included)
200,B0B5WR57PD,"HP 2022 Pavilion 15.6"" IPS FHD Touchscreen Laptop Intel 12th 10-Core i7-1255U Iris Xe Graphics 32GB RAM DDR4 512GB NVMe SSD USB-C WiFi AX BT HDMI Webcam Backlit Keyboard Windows 10 Home w/ RE USB",,"July 6, 2022",15.6 Inches,1920 x 1080 pixels,1920 x 1080 Pixels,3.5 GHz core_i7_family,32 GB DDR4,3200 MHz,512 GB SSD,Intel Iris Xe Graphics,Intel,Integrated,802.11ax,3,6 Hours,HP,HP-15-EG200,HP-15-EG200,PC,Windows 10 Home,8 pounds,14.18 x 9.21 x 0.7 inches,,Blue,Intel,10,DDR4 SDRAM,,Solid State,,AC & Battery,
200,B07Y5PDX7D,"ASUS 2020 VivoBook 15 15.6 Inch FHD 1080P Laptop (AMD Ryzen 3 3200U up to 3.5GHz, 8GB DDR4 RAM, 256GB SSD, AMD Radeon Vega 3, Backlit Keyboard, FP Reader, WiFi, Bluetooth, HDMI, Windows 10) (Grey)",$430.00,"September 20, 2019",15.6 Inches,1920 x 1080 pixels,1920 x 1080,2.6 GHz ryzen_3_3200u,8 GB DDR4,3.5 GHz,256 GB SSD,AMD Radeon Vega 3,AMD,Integrated,802.11ac,1,,ASUS,ASUS,ASUS,PC,Windows 10 Home,3.8 pounds,14.4 x 9.1 x 0.8 inches,,grey,AMD,2,DDR4 SDRAM,256,,No Optical Drive,Battery Powered,1 Lithium Ion batteries required.
200,B0BMVDX3JK,"HP Flagship Chromebook 14"" HD 2-in-1 Touchscreen Laptop, Intel Celeron N4120(Up to 2.6GHz), 4GB RAM, 64GB eMMC, Wi-Fi, Up to 13Hours Battery Life, Bluetooth, Chrome OS, Blue, w/GM Accessories",$279.00,"November 18, 2022",14 Inches,1366 x 768,1366x768 Pixels,2.6 GHz celeron_n,4 GB LPDDR4,,64 GB SSD,Intel UHD Graphics 600,Intel,Integrated,802.11a/g/n/ac,2,,HP,HP Laptop,,,Chrome OS,5.9 pounds,17.68 x 2.72 x 12.01 inches,,2022,Intel,4,DDR4 SDRAM,64 GB,Solid State,DVD-R,,1 Lithium Ion batteries required. (included)
200,B07SJHSYL1,"New HP 17 Laptop,17.3"" FHD IPS Display, 11th Gen Intel Core i5-1135G7(Beats i7-8500), 16GB RAM, 512GB SSD, Wi-Fi 5, Bluetooth, HDMI, Webcam, Windows 11, Backlit Keyboard, Natural Silver 9H",$701.34,"December 15, 2021",17.3 Inches,,1920 x 1080 Pixels,4.2 GHz intel_core_i5_1135g7,16 GB DDR4,,512 GB SSD,Intel Iris Xe Graphics,Intel,Integrated,802.11a/b/g/n/ac,,6 Hours,HP,17,HP 17 Laptop,PC,Windows 11 Home,6.39 pounds,20.51 x 13.66 x 2.72 inches,,Silver,Intel,4,DDR4 SDRAM,,Solid State,,AC & Battery,1 Lithium Ion batteries required. (included)
200,B0BQFZMCM9,"ASUS 2022 14"" FHD Chromebook Laptop, Intel Core M3-8100Y Processor, 8GB RAM, 64GB eMMC Flash Memory, Backlit Keyboard, Intel Graphics, HD Webcam, Chrome OS, Silver, 32GB Snowbell USB Card",$189.00,"December 18, 2022",14 Inches,,1920 x 1080 Pixels,1.1 GHz core_m_family,8 GB LPDDR3,,64 GB SSD,Intel HD Graphics 500,Intel,Integrated,Bluetooth,,,ASUS,,ASUS,PC,Chrome OS,3.09 pounds,12.72 x 9.02 x 0.65 inches,,Silver,Intel,2,DDR4 SDRAM,64 GB,Solid State,,,
200,B0BPNX5KDG,"HP 15 Laptop, 11th Gen Intel Core i5-1135G7 Processor, 16GB RAM, 512B SSD, 15.6-inch Full HD (1920 x 1080) Display, HDMI, 802.11ac, Bluetooth, Windows 10 Home, Long Battery Life, Accessories Included",$638.99,"December 10, 2022",15.6 Inches,,1920 x 1080 Pixels,2.4 GHz intel_core_i5_1135g7,16 GB DDR4,2666 MHz,512 GB SSD,,Intel,Integrated,"Bluetooth, 802.11ac, 2.4 GHz Radio Frequency",3,,HP,6M0Z7UA#ABA,,,Windows 11 Home,3.75 pounds,14.11 x 0.71 x 9.53 inches,,,Intel,4,,512 GB,,,,1 Lithium Ion batteries required. (included)
200,B09RQZNMQW,"HP Laptop 15-dy0025tg 15.6"" HD (1366 x 768) Intel Pentium Silver N5030, Intel UHD Graphics 605, 8GB DDR4 RAM, 256GB SSD Storage, Windows 10 Home, Natural Silver (Renewed)",,"February 3, 2022",15.6 Inches,,1360 x 768 Pixels,1.1 GHz pentium_N5000,8 GB DDR4,2400 MHz,256 GB SSD,Intel UHD Graphics 605,Intel,Integrated,,,11 Hours,HP,15,,PC,Windows 10 Home,4.29 pounds,18.8 x 12.4 x 3.3 inches,,Silver,Intel,4,DDR DRAM,256 GB,Solid State,No Optical Drive,,1 Lithium Polymer batteries required. (included)
200,B09SVR7LGH,"ASUS Chromebook CX1, 15.6"" Full HD NanoEdge Display, Intel Celeron N3350 Processor, 64GB eMMC Storage, 8GB RAM, Chrome OS, Transparent Silver, CX1500CNA-AS84F",$223.99,"February 18, 2022",15.6 Inches,,1920 x 1080 Pixels,2.4 GHz celeron_n3350,8 GB LPDDR4,,64 GB Emmc,,Intel,Integrated,Bluetooth,4,11 Hours,ASUS,ASUS Chromebook CX1,CX1500CNA-AS84F,,Chrome OS,3.97 pounds,14.22 x 0.74 x 9.84 inches,,Silver,Intel,2,DDR4 SDRAM,64 GB,USB 3.2,No Drive,Battery Powered,1 Lithium Ion batteries required. (included)
200,B0B9ZSS7DG,"ASUS ExpertBook Laptop P1510CJA-C71P-CA Intel Core i7-1065G7 (1.3 GHz) 12 GB Memory 512 GB SSD Intel UHD Graphics 15.6"" Windows 10 Pro (Renewed)",$449.95,"August 17, 2022",15.6 Inches,,1920 x 1080 Pixels,1.3 GHz core_i7,12 GB DDR4,,512 GB SSD,Intel UHD Graphics,Intel,Integrated,,3,,ASUS,P1510CJA-C71P-CA-CR,,,Windows 10 Pro,5.17 pounds,,,,Intel,2,,512 GB,,,,1 Lithium Ion batteries required.
200,B09X875G5B,"Newest HP 14"" Flagship Laptop, Windows 11 OS, AMD Dual-Core Processor Up to 2.60 GHz, 4GB RAM, 64GB SSD, Webcam, Silver (Renewed)",$159.00,"April 5, 2022",14 Inches,,,2.6 GHz,4 GB,2.6 GHz,SSD,,AMD,,Bluetooth,,,HP,,"HP 14"" Laptop",,Windows 11,4.4 pounds,12.89 x 8.9 x 0.9 inches,,,AMD,2,DDR4 SDRAM,,USB,,,1 Lithium Ion batteries required.
200,B097KW6MR3,"Latest Lenovo ThinkPad X1 Carbon Gen 9 14"" FHD+ Ultrabook IPS Touchscreen 400 nits,11th gen i7-1165G7, 16GB DDR4, 1TB SSD, Intel Iris Xe Graphics, Fingerprint Reader, Thunderbolt 4, Win 10 Pro, Black",,"June 20, 2021",14 Inches,,1920 x 1200 Pixels,4.7 GHz core_i7_family,16 GB DDR4,4266 MHz,1 TB SSD,Intel Iris Xe Graphics,Intel,Integrated,802.11ax,1,,Lenovo,Lenovo thinkpad,20XW003HUS,PC,Windows 10 Pro,2.49 pounds,12.38 x 8.72 x 0.59 inches,,Black,Intel,4,DDR4 SDRAM,,Solid State,,AC & Battery,1 Lithium Ion batteries required. (included)
